{
  "schemaVersion": 1,
  "collectionId": "daily-brief",
  "month": "2026-09",
  "updatedAt": "2026-10-17T03:52:20.032806Z",
  "briefs": [
    {
      "id": "daily-brief-2026-09-30",
      "collectionId": "daily-brief",
      "date": "2026-09-30",
      "title": "每日重点简报｜09月30日",
      "summary": "OpenAI DevDay 推出 Dots；Electron 自定义 Protocol 跨 Origin 漏洞；Cerebras 获约 100MW 推理集群订单；Coffee Stain Big Break；10 年期美债收益率升至 5.27%。",
      "analysis": "",
      "rawText": "",
      "completeness": "summary",
      "sourceConversation": "每日重点简报",
      "provenance": "通过历史对话检索恢复的标题/摘要，不是原始日报全文。分类和标签为本次整理生成；缺失正文、详细分析、原始引用及重要性评分尚待补录。内容未重新核验。",
      "score": null,
      "items": [
        {
          "id": "daily-brief-2026-09-30-1",
          "title": "OpenAI DevDay 推出 Dots",
          "category": "AI 与智能体",
          "summary": "历史检索保留的标题要点：OpenAI DevDay 推出 Dots。详细正文与分析尚未恢复。",
          "analysis": "",
          "importance": null,
          "tags": [
            "Agent",
            "AI"
          ],
          "sources": []
        },
        {
          "id": "daily-brief-2026-09-30-2",
          "title": "Electron 自定义 Protocol 跨 Origin 漏洞",
          "category": "软件工程",
          "summary": "历史检索保留的标题要点：Electron 自定义 Protocol 跨 Origin 漏洞。详细正文与分析尚未恢复。",
          "analysis": "",
          "importance": null,
          "tags": [
            "开发工具",
            "安全"
          ],
          "sources": []
        },
        {
          "id": "daily-brief-2026-09-30-3",
          "title": "Cerebras 获约 100MW 推理集群订单",
          "category": "算力与硬件",
          "summary": "历史检索保留的标题要点：Cerebras 获约 100MW 推理集群订单。详细正文与分析尚未恢复。",
          "analysis": "",
          "importance": null,
          "tags": [],
          "sources": []
        },
        {
          "id": "daily-brief-2026-09-30-4",
          "title": "Coffee Stain Big Break",
          "category": "游戏与创作",
          "summary": "历史检索保留的标题要点：Coffee Stain Big Break。详细正文与分析尚未恢复。",
          "analysis": "",
          "importance": null,
          "tags": [
            "游戏"
          ],
          "sources": []
        },
        {
          "id": "daily-brief-2026-09-30-5",
          "title": "10 年期美债收益率升至 5.27%",
          "category": "财经与市场",
          "summary": "历史检索保留的标题要点：10 年期美债收益率升至 5.27%。详细正文与分析尚未恢复。",
          "analysis": "",
          "importance": null,
          "tags": [
            "市场"
          ],
          "sources": []
        }
      ]
    },
    {
      "id": "daily-brief-2026-09-29",
      "collectionId": "daily-brief",
      "date": "2026-09-29",
      "title": "每日重点简报｜09月29日",
      "summary": "NVIDIA 推出 Open Agent Safety Platform；AMD 以 82 亿美元收购 World Labs；Anthropic IPO 文件披露经济账；Claude Sonnet 5.5 进入 GitHub Copilot；高油价与 5% 以上利率压制风险资产。",
      "analysis": "",
      "rawText": "",
      "completeness": "summary",
      "sourceConversation": "每日重点简报",
      "provenance": "通过历史对话检索恢复的标题/摘要，不是原始日报全文。分类和标签为本次整理生成；缺失正文、详细分析、原始引用及重要性评分尚待补录。内容未重新核验。",
      "score": null,
      "items": [
        {
          "id": "daily-brief-2026-09-29-1",
          "title": "NVIDIA 推出 Open Agent Safety Platform",
          "category": "AI 与智能体",
          "summary": "历史检索保留的标题要点：NVIDIA 推出 Open Agent Safety Platform。详细正文与分析尚未恢复。",
          "analysis": "",
          "importance": null,
          "tags": [
            "Agent",
            "安全"
          ],
          "sources": []
        },
        {
          "id": "daily-brief-2026-09-29-2",
          "title": "AMD 以 82 亿美元收购 World Labs",
          "category": "AI 与智能体",
          "summary": "历史检索保留的标题要点：AMD 以 82 亿美元收购 World Labs。详细正文与分析尚未恢复。",
          "analysis": "",
          "importance": null,
          "tags": [],
          "sources": []
        },
        {
          "id": "daily-brief-2026-09-29-3",
          "title": "Anthropic IPO 文件披露经济账",
          "category": "财经与市场",
          "summary": "历史检索保留的标题要点：Anthropic IPO 文件披露经济账。详细正文与分析尚未恢复。",
          "analysis": "",
          "importance": null,
          "tags": [
            "AI"
          ],
          "sources": []
        },
        {
          "id": "daily-brief-2026-09-29-4",
          "title": "Claude Sonnet 5.5 进入 GitHub Copilot",
          "category": "软件工程",
          "summary": "历史检索保留的标题要点：Claude Sonnet 5.5 进入 GitHub Copilot。详细正文与分析尚未恢复。",
          "analysis": "",
          "importance": null,
          "tags": [
            "AI",
            "开发工具"
          ],
          "sources": []
        },
        {
          "id": "daily-brief-2026-09-29-5",
          "title": "高油价与 5% 以上利率压制风险资产",
          "category": "AI 与智能体",
          "summary": "历史检索保留的标题要点：高油价与 5% 以上利率压制风险资产。详细正文与分析尚未恢复。",
          "analysis": "",
          "importance": null,
          "tags": [],
          "sources": []
        }
      ]
    },
    {
      "id": "daily-brief-2026-09-28",
      "collectionId": "daily-brief",
      "date": "2026-09-28",
      "title": "每日重点简报｜09月28日",
      "summary": "OpenAI 暂停部分前沿模型训练；GitHub 统一 Copilot Chat 与 Cloud Agent；Anthropic Project Swap；Undead Labs 独立并裁员；SoftBank 发 111 亿美元债券押注 OpenAI。",
      "analysis": "",
      "rawText": "",
      "completeness": "summary",
      "sourceConversation": "每日重点简报",
      "provenance": "通过历史对话检索恢复的标题/摘要，不是原始日报全文。分类和标签为本次整理生成；缺失正文、详细分析、原始引用及重要性评分尚待补录。内容未重新核验。",
      "score": null,
      "items": [
        {
          "id": "daily-brief-2026-09-28-1",
          "title": "OpenAI 暂停部分前沿模型训练",
          "category": "AI 与智能体",
          "summary": "历史检索保留的标题要点：OpenAI 暂停部分前沿模型训练。详细正文与分析尚未恢复。",
          "analysis": "",
          "importance": null,
          "tags": [
            "AI"
          ],
          "sources": []
        },
        {
          "id": "daily-brief-2026-09-28-2",
          "title": "GitHub 统一 Copilot Chat 与 Cloud Agent",
          "category": "软件工程",
          "summary": "历史检索保留的标题要点：GitHub 统一 Copilot Chat 与 Cloud Agent。详细正文与分析尚未恢复。",
          "analysis": "",
          "importance": null,
          "tags": [
            "Agent",
            "开发工具"
          ],
          "sources": []
        },
        {
          "id": "daily-brief-2026-09-28-3",
          "title": "Anthropic Project Swap",
          "category": "AI 与智能体",
          "summary": "历史检索保留的标题要点：Anthropic Project Swap。详细正文与分析尚未恢复。",
          "analysis": "",
          "importance": null,
          "tags": [
            "AI"
          ],
          "sources": []
        },
        {
          "id": "daily-brief-2026-09-28-4",
          "title": "Undead Labs 独立并裁员",
          "category": "游戏与创作",
          "summary": "历史检索保留的标题要点：Undead Labs 独立并裁员。详细正文与分析尚未恢复。",
          "analysis": "",
          "importance": null,
          "tags": [
            "游戏"
          ],
          "sources": []
        },
        {
          "id": "daily-brief-2026-09-28-5",
          "title": "SoftBank 发 111 亿美元债券押注 OpenAI",
          "category": "财经与市场",
          "summary": "历史检索保留的标题要点：SoftBank 发 111 亿美元债券押注 OpenAI。详细正文与分析尚未恢复。",
          "analysis": "",
          "importance": null,
          "tags": [
            "AI"
          ],
          "sources": []
        }
      ]
    },
    {
      "id": "daily-brief-2026-09-27",
      "collectionId": "daily-brief",
      "date": "2026-09-27",
      "title": "每日重点简报｜09月27日",
      "summary": "中美启动 AI 对话机制；SAT 自组织多 Agent 团队；GitHub 将 Slack / Teams 讨论转为工程任务；Meta Horizon Create / Studio 生成可玩游戏。",
      "analysis": "",
      "rawText": "",
      "completeness": "summary",
      "sourceConversation": "每日重点简报",
      "provenance": "通过历史对话检索恢复的标题/摘要，不是原始日报全文。分类和标签为本次整理生成；缺失正文、详细分析、原始引用及重要性评分尚待补录。内容未重新核验。 当前仅恢复四条，未拼凑截断的第五条。",
      "score": null,
      "items": [
        {
          "id": "daily-brief-2026-09-27-1",
          "title": "中美启动 AI 对话机制",
          "category": "AI 与智能体",
          "summary": "历史检索保留的标题要点：中美启动 AI 对话机制。详细正文与分析尚未恢复。",
          "analysis": "",
          "importance": null,
          "tags": [
            "AI"
          ],
          "sources": []
        },
        {
          "id": "daily-brief-2026-09-27-2",
          "title": "SAT 自组织多 Agent 团队",
          "category": "AI 与智能体",
          "summary": "历史检索保留的标题要点：SAT 自组织多 Agent 团队。详细正文与分析尚未恢复。",
          "analysis": "",
          "importance": null,
          "tags": [
            "Agent"
          ],
          "sources": []
        },
        {
          "id": "daily-brief-2026-09-27-3",
          "title": "GitHub 将 Slack / Teams 讨论转为工程任务",
          "category": "软件工程",
          "summary": "历史检索保留的标题要点：GitHub 将 Slack / Teams 讨论转为工程任务。详细正文与分析尚未恢复。",
          "analysis": "",
          "importance": null,
          "tags": [
            "开发工具"
          ],
          "sources": []
        },
        {
          "id": "daily-brief-2026-09-27-4",
          "title": "Meta Horizon Create / Studio 生成可玩游戏",
          "category": "游戏与创作",
          "summary": "历史检索保留的标题要点：Meta Horizon Create / Studio 生成可玩游戏。详细正文与分析尚未恢复。",
          "analysis": "",
          "importance": null,
          "tags": [
            "游戏"
          ],
          "sources": []
        }
      ]
    },
    {
      "id": "daily-brief-2026-09-26",
      "collectionId": "daily-brief",
      "date": "2026-09-26",
      "title": "每日重点简报｜09月26日",
      "summary": "OpenAI Agent 泄露 53 张用户图片；Microsoft Copilot Home / Code / Autopilot 与 Managed Runtime；GitHub Copilot Memory 接入安全修复；Solidigm 拟以最高 1,500 亿美元估值 IPO；AI 交易反弹，Microsoft 上涨 3.7%。",
      "analysis": "",
      "rawText": "",
      "completeness": "summary",
      "sourceConversation": "每日重点简报",
      "provenance": "通过历史对话检索恢复的标题/摘要，不是原始日报全文。分类和标签为本次整理生成；缺失正文、详细分析、原始引用及重要性评分尚待补录。内容未重新核验。",
      "score": null,
      "items": [
        {
          "id": "daily-brief-2026-09-26-1",
          "title": "OpenAI Agent 泄露 53 张用户图片",
          "category": "AI 与智能体",
          "summary": "历史检索保留的标题要点：OpenAI Agent 泄露 53 张用户图片。详细正文与分析尚未恢复。",
          "analysis": "",
          "importance": null,
          "tags": [
            "Agent",
            "AI",
            "安全"
          ],
          "sources": []
        },
        {